{
  "meta": {
    "ja": {
      "title": "全社ITポートフォリオ 2026",
      "subtitle": "基幹刷新・モバイル・データ基盤・セキュリティ"
    },
    "en": {
      "title": "IT Portfolio 2026",
      "subtitle": "Core renewal / Mobile / Data platform / Security"
    }
  },
  "calendar": {
    "workweek": [
      1,
      2,
      3,
      4,
      5
    ],
    "holidays": [
      {
        "date": "2026-01-01",
        "ja": "元日",
        "en": "New Year's Day"
      },
      {
        "date": "2026-01-12",
        "ja": "成人の日",
        "en": "Coming of Age Day"
      },
      {
        "date": "2026-02-11",
        "ja": "建国記念の日",
        "en": "National Foundation Day"
      },
      {
        "date": "2026-02-23",
        "ja": "天皇誕生日",
        "en": "Emperor's Birthday"
      },
      {
        "date": "2026-03-20",
        "ja": "春分の日",
        "en": "Vernal Equinox"
      },
      {
        "date": "2026-04-29",
        "ja": "昭和の日",
        "en": "Showa Day"
      },
      {
        "date": "2026-05-04",
        "ja": "みどりの日",
        "en": "Greenery Day"
      },
      {
        "date": "2026-05-05",
        "ja": "こどもの日",
        "en": "Children's Day"
      },
      {
        "date": "2026-05-06",
        "ja": "振替休日",
        "en": "Substitute Holiday"
      },
      {
        "date": "2026-07-20",
        "ja": "海の日",
        "en": "Marine Day"
      },
      {
        "date": "2026-08-11",
        "ja": "山の日",
        "en": "Mountain Day"
      },
      {
        "date": "2026-09-21",
        "ja": "敬老の日",
        "en": "Respect for the Aged Day"
      },
      {
        "date": "2026-09-22",
        "ja": "国民の休日",
        "en": "National Holiday"
      },
      {
        "date": "2026-09-23",
        "ja": "秋分の日",
        "en": "Autumn Equinox"
      },
      {
        "date": "2026-10-12",
        "ja": "スポーツの日",
        "en": "Sports Day"
      },
      {
        "date": "2026-11-03",
        "ja": "文化の日",
        "en": "Culture Day"
      },
      {
        "date": "2026-11-23",
        "ja": "勤労感謝の日",
        "en": "Labor Thanksgiving"
      },
      {
        "date": "2026-12-29",
        "ja": "年末休業",
        "en": "Year-end closure"
      },
      {
        "date": "2026-12-30",
        "ja": "年末休業",
        "en": "Year-end closure"
      },
      {
        "date": "2026-12-31",
        "ja": "大晦日",
        "en": "New Year's Eve"
      }
    ],
    "extraWorkdays": [
      "2026-12-12"
    ]
  },
  "assignees": {
    "SA": {
      "ja": "佐藤",
      "en": "Sato"
    },
    "TK": {
      "ja": "田中",
      "en": "Tanaka"
    },
    "YM": {
      "ja": "山本",
      "en": "Yamamoto"
    },
    "KB": {
      "ja": "小林",
      "en": "Kobayashi"
    },
    "IT": {
      "ja": "伊藤",
      "en": "Ito"
    },
    "WT": {
      "ja": "渡辺",
      "en": "Watanabe"
    },
    "NK": {
      "ja": "中村",
      "en": "Nakamura"
    },
    "KT": {
      "ja": "加藤",
      "en": "Kato"
    },
    "YS": {
      "ja": "吉田",
      "en": "Yoshida"
    },
    "HS": {
      "ja": "林",
      "en": "Hayashi"
    },
    "MT": {
      "ja": "松本",
      "en": "Matsumoto"
    },
    "IN": {
      "ja": "井上",
      "en": "Inoue"
    },
    "ACME": {
      "ja": "アクメ社",
      "en": "ACME Corp."
    },
    "BPO": {
      "ja": "委託先BPO",
      "en": "BPO Vendor"
    }
  },
  "projects": [
    {
      "id": "P1",
      "ja": "基幹システム刷新",
      "en": "Core system renewal",
      "accent": true,
      "milestones": [
        {
          "date": "2026-02-27",
          "ja": "要件確定",
          "en": "Reqs frozen"
        },
        {
          "date": "2026-05-29",
          "ja": "設計完了",
          "en": "Design complete"
        },
        {
          "date": "2026-10-30",
          "ja": "UAT開始",
          "en": "UAT start"
        },
        {
          "date": "2026-12-14",
          "ja": "本番稼働",
          "en": "Go live",
          "rose": true
        }
      ],
      "children": [
        {
          "id": "req",
          "ja": "要件定義",
          "en": "Requirements",
          "children": [
            {
              "id": "req.1",
              "ja": "現行業務ヒアリング",
              "en": "As-is interviews",
              "who": "SA",
              "plan": {
                "start": "2026-01-13",
                "end": "2026-01-16"
              },
              "personDays": 4,
              "deps": [],
              "critical": true,
              "actual": {
                "start": "2026-01-13",
                "end": "2026-01-20"
              },
              "progress": 1
            },
            {
              "id": "req.2",
              "ja": "業務フロー整理",
              "en": "Business flow mapping",
              "who": "NK",
              "plan": {
                "start": "2026-01-19",
                "end": "2026-01-23"
              },
              "personDays": 5,
              "deps": [
                "req.1"
              ],
              "critical": true,
              "actual": {
                "start": "2026-01-19",
                "end": "2026-01-23"
              },
              "progress": 1
            },
            {
              "id": "req.3",
              "ja": "要求一覧化",
              "en": "Requirements inventory",
              "who": "SA",
              "plan": {
                "start": "2026-01-26",
                "end": "2026-02-04"
              },
              "personDays": 8,
              "deps": [
                "req.2"
              ],
              "critical": true,
              "actual": {
                "start": "2026-01-26",
                "end": "2026-02-05"
              },
              "progress": 1
            },
            {
              "id": "req.4",
              "ja": "要件定義書作成",
              "en": "Requirements spec",
              "who": "SA",
              "plan": {
                "start": "2026-02-05",
                "end": "2026-02-10"
              },
              "personDays": 4,
              "deps": [
                "req.3"
              ],
              "critical": true,
              "actual": {
                "start": "2026-02-06",
                "end": "2026-02-10"
              },
              "progress": 1
            },
            {
              "id": "req.5",
              "ja": "要件レビュー・承認",
              "en": "Review & sign-off",
              "who": "NK",
              "plan": {
                "start": "2026-02-12",
                "end": "2026-02-17"
              },
              "personDays": 4,
              "deps": [
                "req.4"
              ],
              "critical": true,
              "actual": {
                "start": "2026-02-12",
                "end": "2026-02-17"
              },
              "progress": 1
            }
          ]
        },
        {
          "id": "des",
          "ja": "設計",
          "en": "Design",
          "children": [
            {
              "id": "des.b",
              "ja": "基本設計",
              "en": "Basic design",
              "children": [
                {
                  "id": "bd.1",
                  "ja": "アーキテクチャ設計",
                  "en": "Architecture design",
                  "who": "KB",
                  "plan": {
                    "start": "2026-03-02",
                    "end": "2026-03-12"
                  },
                  "personDays": 9,
                  "deps": [
                    "req.5"
                  ],
                  "critical": true,
                  "actual": {
                    "start": "2026-03-02",
                    "end": "2026-03-12"
                  },
                  "progress": 1
                },
                {
                  "id": "bd.2",
                  "ja": "DB論理設計",
                  "en": "Logical DB design",
                  "who": "YM",
                  "plan": {
                    "start": "2026-03-13",
                    "end": "2026-03-24"
                  },
                  "personDays": 7,
                  "deps": [
                    "bd.1"
                  ],
                  "critical": true,
                  "actual": {
                    "start": "2026-03-13",
                    "end": "2026-03-24"
                  },
                  "progress": 1
                },
                {
                  "id": "bd.3",
                  "ja": "画面基本設計",
                  "en": "Screen basic design",
                  "who": "KB",
                  "plan": {
                    "start": "2026-03-25",
                    "end": "2026-04-02"
                  },
                  "personDays": 7,
                  "deps": [
                    "bd.2"
                  ],
                  "critical": true,
                  "actual": {
                    "start": "2026-03-25",
                    "end": "2026-04-02"
                  },
                  "progress": 1
                },
                {
                  "id": "bd.4",
                  "ja": "外部IF基本設計",
                  "en": "External IF design",
                  "who": "YM",
                  "plan": {
                    "start": "2026-04-03",
                    "end": "2026-04-09"
                  },
                  "personDays": 5,
                  "deps": [
                    "bd.3"
                  ],
                  "critical": true,
                  "actual": {
                    "start": "2026-04-03",
                    "end": "2026-04-10"
                  },
                  "progress": 1
                }
              ]
            },
            {
              "id": "des.d",
              "ja": "詳細設計",
              "en": "Detail design",
              "children": [
                {
                  "id": "dd.1",
                  "ja": "DB物理設計",
                  "en": "Physical DB design",
                  "who": "KB",
                  "plan": {
                    "start": "2026-04-10",
                    "end": "2026-04-20"
                  },
                  "personDays": 7,